{
  "version": "1.0",
  "docsPath": "./scribe",
  "projectKeyword": "my-api",
  "createdAt": "2026-02-26T14:00:00Z",
  "lastSessionNumber": 1,
  "preferences": {
    "autoGenerateADRs": true,
    "autoUpdateChangelog": true,
    "includeCodeSnippets": true,
    "maxSnippetLines": 20,
    "timestampFormat": "YYYY-MM-DD-HH-MM",
    "adrNumberFormat": "0000"
  },
  "metadata": {
    "projectName": "My API",
    "description": "Example API project demonstrating Session Scribe documentation",
    "repository": "https://github.com/example/my-api",
    "team": ["Development Team"]
  }
}
